<?xml version="1.0" encoding="ISO-8859-15" ?>
<!DOCTYPE repository SYSTEM "metamusic-repository.dtd">

<!-- MetaMusic repository XML export of genre and user -->

<repository>

  <user creationDate="08.08.2008 08:08:08"
        EMail="a@localhost"
        fullName="a"
        id="_4711"
        locale="en"
        modificationDate="09.09.2009 09:09:09"
        name="a"
        password="a">
    <creationUser ref="_4711"/>
    <modificationUser ref="_4711"/>
  </user>

  <genre creationDate="10.10.2010 10:10:10"
         id="_4712"
         modificationDate="07.07.2007 07:07:07"
         name="c">
    <creationUser ref="_4711"/>
    <modificationUser ref="_4714"/>
  </genre>
  <genre creationDate="06.06.2006 06:06:06"
         id="_4713"
         modificationDate="11.11.2011 11:11:11"
         name="d">
    <creationUser ref="_4711"/>
    <modificationUser ref="_4714"/>
    <specialisation ref="_4712"/>
  </genre>

  <user creationDate="05.05.2005 05:05:05"
        EMail="b@localhost"
        fullName="b"
        id="_4714"
        locale="de"
        modificationDate="12.12.2012 12:12:12"
        name="b"
        password="b">
    <creationUser ref="_4711"/>
    <modificationUser ref="_4711"/>
  </user>

</repository>
